<?xml version="1.0" encoding="UTF-8"?>
<AVAIL_SERVICES xmlns:xsi="http://www.w3.org/2001/XMLSchema-instance"
    xmlns:urn="http://www.example.com/name"  
    xsi:schemaLocation="http://www.example.com/name avail_service.xsd">
<AVAIL_SERVICE>
          <SERVICE_CLASS>SFTC</SERVICE_CLASS>
          <SERVICE_RESULT>GREEN</SERVICE_RESULT>
          <SERVICE_STATUS>AVAILABLE</SERVICE_STATUS>
          <QUALIFIED_SERVICE>
            <SERVICE_CODE>FCBPS</SERVICE_CODE>
            <PROFILE_CODE>100M_20M_R</PROFILE_CODE>
          </QUALIFIED_SERVICE>
          <QUALIFIED_SERVICE>
            <SERVICE_CODE>FCVUS</SERVICE_CODE>
            <PROFILE_CODE>100M_20M_R</PROFILE_CODE>
          </QUALIFIED_SERVICE>
          <SERVICE_ATTRIBUTES>
            <ATTRIBUTE>
              <NAME>APPOINTMENT_REQUIRED</NAME>
              <VALUE>Y</VALUE>
            </ATTRIBUTE>
            <ATTRIBUTE>
              <NAME>APPOINTMENT_TYPE</NAME>
              <VALUE>INSTALLATION</VALUE>
            </ATTRIBUTE>
          </SERVICE_ATTRIBUTES>
          <INTERNAL_AVAIL>
            <EIRCOM>
              <FIBRE>
                <HAS_VUA_QS>Y</HAS_VUA_QS>
                <HAS_BSP_QS>Y</HAS_BSP_QS>
                <VUA_DELIVERABLE>N</VUA_DELIVERABLE>
              </FIBRE>
            </EIRCOM>
          </INTERNAL_AVAIL>
        </AVAIL_SERVICE>
        <AVAIL_SERVICE>
          <SERVICE_CLASS>SFTH</SERVICE_CLASS>
          <SERVICE_RESULT>GREEN</SERVICE_RESULT>
          <SERVICE_STATUS>AVAILABLE</SERVICE_STATUS>
          <QUALIFIED_SERVICE>
            <SERVICE_CODE>FHBPS</SERVICE_CODE>
            <PROFILE_CODE>150M_20M_FR</PROFILE_CODE>
            <RECOMMENDED>Y</RECOMMENDED>
          </QUALIFIED_SERVICE>
          <QUALIFIED_SERVICE>
            <SERVICE_CODE>FHBPS1G</SERVICE_CODE>
            <PROFILE_CODE>1G_20M_F</PROFILE_CODE>
          </QUALIFIED_SERVICE>
          <QUALIFIED_SERVICE>
            <SERVICE_CODE>FHBPS300</SERVICE_CODE>
            <PROFILE_CODE>300M_20M_R</PROFILE_CODE>
            <RECOMMENDED>Y</RECOMMENDED>
          </QUALIFIED_SERVICE>
          <QUALIFIED_SERVICE>
            <SERVICE_CODE>FHBPS500</SERVICE_CODE>
            <PROFILE_CODE>500M_50M_F</PROFILE_CODE>
            <RECOMMENDED>Y</RECOMMENDED>
          </QUALIFIED_SERVICE>
          <QUALIFIED_SERVICE>
            <SERVICE_CODE>FHVUS</SERVICE_CODE>
            <PROFILE_CODE>150M_20M_FR</PROFILE_CODE>
            <RECOMMENDED>Y</RECOMMENDED>
          </QUALIFIED_SERVICE>
          <QUALIFIED_SERVICE>
            <SERVICE_CODE>FHVUS1G</SERVICE_CODE>
            <PROFILE_CODE>1G_20M_F</PROFILE_CODE>
          </QUALIFIED_SERVICE>
          <QUALIFIED_SERVICE>
            <SERVICE_CODE>FHVUS300</SERVICE_CODE>
            <PROFILE_CODE>300M_20M_R</PROFILE_CODE>
            <RECOMMENDED>Y</RECOMMENDED>
          </QUALIFIED_SERVICE>
          <QUALIFIED_SERVICE>
            <SERVICE_CODE>FHVUS500</SERVICE_CODE>
            <PROFILE_CODE>500M_50M_F</PROFILE_CODE>
            <RECOMMENDED>Y</RECOMMENDED>
          </QUALIFIED_SERVICE>
          <SERVICE_ATTRIBUTES>
            <ATTRIBUTE>
              <NAME>APPOINTMENT_REQUIRED</NAME>
              <VALUE>Y</VALUE>
            </ATTRIBUTE>
            <ATTRIBUTE>
              <NAME>APPOINTMENT_TYPE</NAME>
              <VALUE>INSTALLATION</VALUE>
            </ATTRIBUTE>
          </SERVICE_ATTRIBUTES>
          <INTERNAL_AVAIL>
            <EIRCOM>
              <FIBRE>
                <HAS_VUA_QS>Y</HAS_VUA_QS>
                <HAS_BSP_QS>Y</HAS_BSP_QS>
                <VUA_DELIVERABLE>N</VUA_DELIVERABLE>
              </FIBRE>
            </EIRCOM>
          </INTERNAL_AVAIL>
        </AVAIL_SERVICE>
</AVAIL_SERVICES>